<?xml version="1.0" encoding="UTF-8" ?>
<!ELEMENT schema (name,path,units)>
<!ELEMENT name (#PCDATA)>
<!ELEMENT path (#PCDATA)>
<!ELEMENT units (unit+)>
<!ELEMENT unit (name,path,units?)>
