<?xml version="1.0" encoding="UTF-8"?>
<!DOCTYPE schema SYSTEM "file:///usr/local/share/ddtype/schema/dtd/schema.dtd">

<schema>
	<name>郑码</name>
	<path>zm</path>
	<units>
		<unit>
			<name>字根</name>
			<path>zg</path>
			<units>
				<unit>
					<name>主根</name>
					<path>zg</path>
				</unit>
				<unit>
					<name>副根</name>
					<path>fg</path>
				</unit>
			</units>
		</unit>
		<unit>
			<name>单字</name>
			<path>dz</path>
		</unit>
	</units>
</schema>
